Title,Link
Possible Bearish Signals With Apple Insiders Disposing Stock - Yahoo Finance,https://news.google.com/rss/articles/CBMiVWh0dHBzOi8vZmluYW5jZS55YWhvby5jb20vbmV3cy9wb3NzaWJsZS1iZWFyaXNoLXNpZ25hbHMtYXBwbGUtaW5zaWRlcnMtMTIwMDE5MDY1Lmh0bWzSAQA?oc=5
Billionaire Warren Buffett Has $135 Billion Invested in Just 1 Artificial Intelligence (AI) Stock. Is It Time to Buy? - The Motley Fool,https://news.google.com/rss/articles/CBMiXWh0dHBzOi8vd3d3LmZvb2wuY29tL2ludmVzdGluZy8yMDI0LzA3LzIxL2JpbGxpb25haXJlLXdhcnJlbi1idWZmZXR0LWhhcy0xMzUtYmlsbGlvbi1pbnZlc3RlL9IBAA?oc=5
Apple Stock Buybacks And AI Are Just For Optics (NASDAQ:AAPL) - Seeking Alpha,https://news.google.com/rss/articles/CBMiVGh0dHBzOi8vc2Vla2luZ2FscGhhLmNvbS9hcnRpY2xlLzQ3MDUzNzUtYXBwbGUtc3RvY2stYnV5YmFja3MtYWktYXJlLWp1c3QtZm9yLW9wdGljc9IBAA?oc=5
Apple (AAPL) Re-Emerged as a Top Performer in Q2 - Yahoo Finance,https://news.google.com/rss/articles/CBMiTmh0dHBzOi8vZmluYW5jZS55YWhvby5jb20vbmV3cy9hcHBsZS1hYXBsLWVtZXJnZWQtdG9wLXBlcmZvcm1lci0wNzI4NTkzNDQuaHRtbNIBAA?oc=5
Apple Stock Is More Expensive Than Nvidia (NASDAQ:AAPL) - Seeking Alpha,https://news.google.com/rss/articles/CBMiUmh0dHBzOi8vc2Vla2luZ2FscGhhLmNvbS9hcnRpY2xlLzQ3MDUyNDgtYXBwbGUtc3RvY2staXMtbW9yZS1leHBlbnNpdmUtdGhhbi1udmlkaWHSAQA?oc=5
Apple Stock Hits Record High as Analysts Hike Price Targets on AI Optimism - Investopedia,https://news.google.com/rss/articles/CBMiVmh0dHBzOi8vd3d3LmludmVzdG9wZWRpYS5jb20vYXBwbGUtc3RvY2stcHJpY2UtcmVjb3JkLWhpZ2gtYW5hbHlzdHMtdGFyZ2V0cy1haS04Njc4MDE20gEA?oc=5
Will Apple Stock Split In 2024? July Edition - Forbes,https://news.google.com/rss/articles/CBMiTmh0dHBzOi8vd3d3LmZvcmJlcy5jb20vc2l0ZXMvaW52ZXN0b3ItaHViL2FydGljbGUvd2lsbC1hcHBsZS1zdG9jay1zcGxpdC0yMDI0L9IBAA?oc=5
Apple stock surges to record high after AI announcements - Yahoo Finance,https://news.google.com/rss/articles/CBMiZmh0dHBzOi8vZmluYW5jZS55YWhvby5jb20vbmV3cy9hcHBsZS1zdG9jay1zdXJnZXMtdG8tcmVjb3JkLWhpZ2gtYWZ0ZXItYWktYW5ub3VuY2VtZW50cy0xNTAzMjU5MjIuaHRtbNIBAA?oc=5
Apple Stock: Time To Sell (Downgrade) (NASDAQ:AAPL) - Seeking Alpha,https://news.google.com/rss/articles/CBMiVmh0dHBzOi8vc2Vla2luZ2FscGhhLmNvbS9hcnRpY2xlLzQ3MDQyNDgtYXBwbGUtc3RvY2stdGltZS10by1zZWxsLWRvd25ncmFkZS1hYXBsLXN0b2Nr0gEA?oc=5
Apple’s (NASDAQ:AAPL) Q3 Earnings Preview: Is This the End of Lackluster Quarters? - TipRanks,https://news.google.com/rss/articles/CBMiamh0dHBzOi8vd3d3LnRpcHJhbmtzLmNvbS9uZXdzL2FwcGxlcy1uYXNkYXFhYXBsLXEzLWVhcm5pbmdzLXByZXZpZXctaXMtdGhpcy10aGUtZW5kLW9mLWxhY2tsdXN0ZXItcXVhcnRlcnPSAQA?oc=5
"Apple Stock Quotes, Company News And Chart Analysis | Stock News & Stock Market Analysis - Investor's Business Daily",https://news.google.com/rss/articles/CBMiXWh0dHBzOi8vd3d3LmludmVzdG9ycy5jb20vbmV3cy90ZWNobm9sb2d5L2FwcGxlLXN0b2NrLXF1b3Rlcy1jb21wYW55LW5ld3MtYW5kLWNoYXJ0LWFuYWx5c2lzL9IBAA?oc=5
"Wall Street is Warming Up to Apple Stock Again, Here's Why - Nasdaq",https://news.google.com/rss/articles/CBMiT2h0dHBzOi8vd3d3Lm5hc2RhcS5jb20vYXJ0aWNsZXMvd2FsbC1zdHJlZXQtd2FybWluZy1hcHBsZS1zdG9jay1hZ2Fpbi1oZXJlcy13aHnSAQA?oc=5
AAPL Stock Analysis: Is Apple Really a Good Long-Term AI Bet? - InvestorPlace,https://news.google.com/rss/articles/CBMiXmh0dHBzOi8vaW52ZXN0b3JwbGFjZS5jb20vMjAyNC8wNy9hYXBsLXN0b2NrLWFuYWx5c2lzLWlzLWFwcGxlLXJlYWxseS1hLWdvb2QtbG9uZy10ZXJtLWFpLWJldC_SAQA?oc=5
Wooster Corthell Wealth Management Inc. Has $1.82 Million Stock Holdings in Apple Inc. (NASDAQ:AAPL) - Defense World,https://news.google.com/rss/articles/CBMiiwFodHRwczovL3d3dy5kZWZlbnNld29ybGQubmV0LzIwMjQvMDcvMjIvd29vc3Rlci1jb3J0aGVsbC13ZWFsdGgtbWFuYWdlbWVudC1pbmMtaGFzLTEtODItbWlsbGlvbi1zdG9jay1ob2xkaW5ncy1pbi1hcHBsZS1pbmMtbmFzZGFxYWFwbC5odG1s0gEA?oc=5
How to Buy Apple Stock (AAPL) - NerdWallet,https://news.google.com/rss/articles/CBMiPGh0dHBzOi8vd3d3Lm5lcmR3YWxsZXQuY29tL2FydGljbGUvaW52ZXN0aW5nL2J1eS1hcHBsZS1zdG9ja9IBAA?oc=5
"How Apple’s stock can reach $300, according to Wall Street’s new biggest bull - MarketWatch",https://news.google.com/rss/articles/CBMidGh0dHBzOi8vd3d3Lm1hcmtldHdhdGNoLmNvbS9zdG9yeS9ob3ctYXBwbGVzLXN0b2NrLWNhbi1yZWFjaC0zMDAtYWNjb3JkaW5nLXRvLXdhbGwtc3RyZWV0cy1uZXctYmlnZ2VzdC1idWxsLWU3ZTcxY2Jk0gF4aHR0cHM6Ly93d3cubWFya2V0d2F0Y2guY29tL2FtcC9zdG9yeS9ob3ctYXBwbGVzLXN0b2NrLWNhbi1yZWFjaC0zMDAtYWNjb3JkaW5nLXRvLXdhbGwtc3RyZWV0cy1uZXctYmlnZ2VzdC1idWxsLWU3ZTcxY2Jk?oc=5
Apple Stock Forecast: Why the Best Is Yet to Come for AAPL - Nasdaq,https://news.google.com/rss/articles/CBMiS2h0dHBzOi8vd3d3Lm5hc2RhcS5jb20vYXJ0aWNsZXMvYXBwbGUtc3RvY2stZm9yZWNhc3Qtd2h5LWJlc3QteWV0LWNvbWUtYWFwbNIBAA?oc=5
Macroview Investment Management LLC Grows Stock Position in Apple Inc. (NASDAQ:AAPL) - Defense World,https://news.google.com/rss/articles/CBMifWh0dHBzOi8vd3d3LmRlZmVuc2V3b3JsZC5uZXQvMjAyNC8wNy8yMi9tYWNyb3ZpZXctaW52ZXN0bWVudC1tYW5hZ2VtZW50LWxsYy1ncm93cy1zdG9jay1wb3NpdGlvbi1pbi1hcHBsZS1pbmMtbmFzZGFxYWFwbC5odG1s0gEA?oc=5
Is Apple Inc. (NASDAQ:AAPL) The Most Undervalued AI Stock to Buy Now? - Yahoo Finance,https://news.google.com/rss/articles/CBMiSGh0dHBzOi8vZmluYW5jZS55YWhvby5jb20vbmV3cy9hcHBsZS1pbmMtbmFzZGFxLWFhcGwtbW9zdC0wOTQ5NTgyMTYuaHRtbNIBAA?oc=5
Is Apple Stock A Buy After Tech Giant Hits $3.5 Trillion Market Cap? - Investor's Business Daily,https://news.google.com/rss/articles/CBMiN2h0dHBzOi8vd3d3LmludmVzdG9ycy5jb20vcmVzZWFyY2gvYXBwbGUtc3RvY2stYnV5LW5vdy_SAQA?oc=5
