Title,Link
"Amazon.com, Inc. (NASDAQ:AMZN) Shares Could Be 40% Below Their Intrinsic Value Estimate - Yahoo Finance",https://news.google.com/rss/articles/CBMiSGh0dHBzOi8vZmluYW5jZS55YWhvby5jb20vbmV3cy9hbWF6b24tY29tLWluYy1uYXNkYXEtYW16bi0xMzAwMTA2NTIuaHRtbNIBAA?oc=5
2 No-Brainer Stocks I'd Buy Right Now Without Hesitation - The Motley Fool,https://news.google.com/rss/articles/CBMiT2h0dHBzOi8vd3d3LmZvb2wuY29tL2ludmVzdGluZy8yMDI0LzA3LzIyLzItbm8tYnJhaW5lci1zdG9ja3MtaWQtYnV5LXJpZ2h0LW5vdy_SAQA?oc=5
"MSFT, AMZN, or GOOGL: Which Cloud Computing Player is the Best AI Stock? - TipRanks",https://news.google.com/rss/articles/CBMiamh0dHBzOi8vd3d3LnRpcHJhbmtzLmNvbS9uZXdzL2FydGljbGUvbXNmdC1hbXpuLW9yLWdvb2dsLXdoaWNoLWNsb3VkLWNvbXB1dGluZy1wbGF5ZXItaXMtdGhlLWJlc3QtYWktc3RvY2vSAQA?oc=5
Amazon: Never Bet Against America (NASDAQ:AMZN) - Seeking Alpha,https://news.google.com/rss/articles/CBMiSWh0dHBzOi8vc2Vla2luZ2FscGhhLmNvbS9hcnRpY2xlLzQ3MDUzMjItYW1hem9uLW5ldmVyLWJldC1hZ2FpbnN0LWFtZXJpY2HSAQA?oc=5
Amazon.com Inc (AMZN-Q) Quote - Press Release - The Globe and Mail,https://news.google.com/rss/articles/CBMilwJodHRwczovL3d3dy50aGVnbG9iZWFuZG1haWwuY29tL2ludmVzdGluZy9tYXJrZXRzL3N0b2Nrcy9BTVpOL3ByZXNzcmVsZWFzZXMvMjc1MjE0MTgvYS1vbmNlLWluLWEtZ2VuZXJhdGlvbi1pbnZlc3RtZW50LW9wcG9ydHVuaXR5LXdoeS1pLXRoaW5rLXRoaXMtd2FycmVuLWJ1ZmZldHQtYW5kLWNhdGhpZS13b29kLWFydGlmaWNpYWwtaW50ZWxsaWdlbmNlLWFpLXN0b2NrLXdpbGwtYmUtdGhlLWJlc3QtbWFnbmlmaWNlbnQtc2V2ZW4tb3Bwb3J0dW5pdHktZm9yLWRlY2FkZXMtdG8tY29tZS_SAQA?oc=5
Amazon.com’s (AMZN) Q2 Results Exceeded Expectations - Yahoo Finance,https://news.google.com/rss/articles/CBMiSGh0dHBzOi8vZmluYW5jZS55YWhvby5jb20vbmV3cy9hbWF6b24tY29tLWFtem4tcTItcmVzdWx0cy0wNjI1MTM1NDkuaHRtbNIBAA?oc=5
3 Reasons to Buy Amazon Stock Like There's No Tomorrow - The Motley Fool,https://news.google.com/rss/articles/CBMiXWh0dHBzOi8vd3d3LmZvb2wuY29tL2ludmVzdGluZy8yMDI0LzA3LzIwLzMtcmVhc29ucy10by1idXktYW1hem9uLXN0b2NrLWxpa2UtdGhlcmVzLW5vLXRvbW9yL9IBAA?oc=5
"As Amazon Prime Day Hits Records, Is Now a Great Opportunity to Buy Amazon Stock? - The Motley Fool",https://news.google.com/rss/articles/CBMiXWh0dHBzOi8vd3d3LmZvb2wuY29tL2ludmVzdGluZy8yMDI0LzA3LzIwL2FzLWFtYXpvbi1wcmltZS1kYXktaGl0cy1yZWNvcmRzLWlzLW5vdy1hLWdyZWF0LW9wL9IBAA?oc=5
Forget Costco: Buy This Unstoppable Growth Stock Instead - The Motley Fool,https://news.google.com/rss/articles/CBMiXWh0dHBzOi8vd3d3LmZvb2wuY29tL2ludmVzdGluZy8yMDI0LzA3LzIwL2ZvcmdldC1jb3N0Y28tYnV5LXRoaXMtdW5zdG9wcGFibGUtZ3Jvd3RoLXN0b2NrLWluL9IBAA?oc=5
Generative AI Seen as ‘Inflection Point’ for Amazon.com Inc (NASDAQ:AMZN) - Yahoo Finance,https://news.google.com/rss/articles/CBMiUWh0dHBzOi8vZmluYW5jZS55YWhvby5jb20vbmV3cy9nZW5lcmF0aXZlLWFpLXNlZW4taW5mbGVjdGlvbi1wb2ludC0wOTEzMjc1ODIuaHRtbNIBAA?oc=5
Magnificent Seven Stocks To Buy And Watch - Investor's Business Daily,https://news.google.com/rss/articles/CBMiUWh0dHBzOi8vd3d3LmludmVzdG9ycy5jb20vcmVzZWFyY2gvbWFnbmlmaWNlbnQtc2V2ZW4tc3RvY2tzLXRvLWJ1eS1hbmQtYW5kLXdhdGNoL9IBAA?oc=5
Why Amazon Stock Is the Biggest Bargain After Amazon Prime Day - Kiplinger's Personal Finance,https://news.google.com/rss/articles/CBMiX2h0dHBzOi8vd3d3LmtpcGxpbmdlci5jb20vaW52ZXN0aW5nL3doeS1hbWF6b24tc3RvY2staXMtdGhlLWJpZ2dlc3QtYmFyZ2Fpbi1vbi1hbWF6b24tcHJpbWUtZGF50gEA?oc=5
MELI vs. AMZN: Which E-Commerce Stock Is the Better Buy? - TipRanks,https://news.google.com/rss/articles/CBMiU2h0dHBzOi8vd3d3LnRpcHJhbmtzLmNvbS9uZXdzL2FydGljbGUvbWVsaS12cy1hbXpuLXdoaWNoLWUtY29tbWVyY2Utc3RvY2staXMtYmV0dGVy0gEA?oc=5
Amazon Stock (AMZN) Price Prediction and Forecast 2025-2030 - 24/7 Wall St.,https://news.google.com/rss/articles/CBMiW2h0dHBzOi8vMjQ3d2FsbHN0LmNvbS9pbnZlc3RpbmcvMjAyNC8wNy8xOC9hbWF6b24tc3RvY2stYW16bi1wcmljZS1wcmVkaWN0aW9uLWFuZC1mb3JlY2FzdC_SAQA?oc=5
"Amazon.com, Inc. (NASDAQ:AMZN) Stock Position Raised by AAFMAA Wealth Management & Trust LLC - Defense World",https://news.google.com/rss/articles/CBMiggFodHRwczovL3d3dy5kZWZlbnNld29ybGQubmV0LzIwMjQvMDcvMjIvYW1hem9uLWNvbS1pbmMtbmFzZGFxYW16bi1zdG9jay1wb3NpdGlvbi1yYWlzZWQtYnktYWFmbWFhLXdlYWx0aC1tYW5hZ2VtZW50LXRydXN0LWxsYy5odG1s0gEA?oc=5
Why Amazon stock is crashing - Finbold - Finance in Bold,https://news.google.com/rss/articles/CBMiMWh0dHBzOi8vZmluYm9sZC5jb20vd2h5LWFtYXpvbi1zdG9jay1pcy1jcmFzaGluZy_SAQA?oc=5
"AMZN stock: Key news, insider trading, valuation & analysts - ForexLive",https://news.google.com/rss/articles/CBMiLGh0dHBzOi8vd3d3LmZvcmV4bGl2ZS5jb20vc3RvY2tzL0FNWk4tc3RvY2sv0gEA?oc=5
"Amazon.com, Inc. (NASDAQ:AMZN) Shares Purchased by AAFMAA Wealth Management & Trust LLC - American Banking and Market News",https://news.google.com/rss/articles/CBMihAFodHRwczovL3d3dy5hbWVyaWNhbmJhbmtpbmduZXdzLmNvbS8yMDI0LzA3LzIyL2FtYXpvbi1jb20taW5jLW5hc2RhcWFtem4tc2hhcmVzLXB1cmNoYXNlZC1ieS1hYWZtYWEtd2VhbHRoLW1hbmFnZW1lbnQtdHJ1c3QtbGxjLmh0bWzSAQA?oc=5
5 Things to Know Before the Stock Market Opens - Investopedia,https://news.google.com/rss/articles/CBMiVmh0dHBzOi8vd3d3LmludmVzdG9wZWRpYS5jb20vNS10aGluZ3MtdG8ta25vdy1iZWZvcmUtbWFya2V0LW9wZW5zLWp1bHktMTYtMjAyNC04Njc4NDcz0gEA?oc=5
Is Amazon Stock A Buy As Analysts Project Strong Prime Day Sales? - Investor's Business Daily,https://news.google.com/rss/articles/CBMiR2h0dHBzOi8vd3d3LmludmVzdG9ycy5jb20vbmV3cy90ZWNobm9sb2d5L2lzLWFtYXpvbi1zdG9jay1idXktbm93LWFtem4v0gEA?oc=5
